<!ELEMENT employees (employee)+>
<!ELEMENT employee (id, name,salary)>
<!ELEMENT id (#PCDATA)>
<!ELEMENT name (#PCDATA)>
<!ELEMENT salary (#PCDATA)>
<!ATTLIST employees type CDATA #REQUIRED>